{
  "schema_version": "2.0.0",
  "registry": "detectors",
  "registry_version": "2026-08-31.1",
  "snapshot_hash_scope": "SHA-256 of each fictional detector/version label; these are not provider snapshots.",
  "entries": [
    {
      "id": "detA",
      "owner": "Humanizer fixture maintainers",
      "version": "unknown",
      "status": "synthetic_fixture_only",
      "source_reference": "aiproofing/benchmark/data/cards/synthetic_detA_detector.md",
      "reviewed_at": "2026-08-31T00:00:00Z",
      "snapshot_hash": "a5938dc517660e95ae89db598c4b7d31cffd06204b020234f007cca8acdcbf0e",
      "allowed_versions": ["unknown", "v1", "v2"],
      "version_card_refs": {
        "unknown": "aiproofing/benchmark/data/cards/synthetic_detA_detector.md",
        "v1": "aiproofing/benchmark/data/cards/synthetic_detA_v1_detector.md",
        "v2": "aiproofing/benchmark/data/cards/synthetic_detA_v2_detector.md"
      }
    },
    {
      "id": "detB",
      "owner": "Humanizer fixture maintainers",
      "version": "unknown",
      "status": "synthetic_fixture_only",
      "source_reference": "aiproofing/benchmark/data/cards/synthetic_detB_detector.md",
      "reviewed_at": "2026-08-31T00:00:00Z",
      "snapshot_hash": "98049959861fdcb85689a7832235b89dcb15fbf61cb9474349bac5171d37e2bd",
      "allowed_versions": ["unknown"],
      "version_card_refs": {
        "unknown": "aiproofing/benchmark/data/cards/synthetic_detB_detector.md"
      }
    },
    {
      "id": "fixture-verifier",
      "owner": "Humanizer fixture maintainers",
      "version": "1",
      "status": "synthetic_fixture_only",
      "source_reference": "aiproofing/benchmark/data/cards/synthetic_fixture_verifier_detector.md",
      "reviewed_at": "2026-08-31T00:00:00Z",
      "snapshot_hash": "5964e09fc9dd96f3304eddb6f58ecfa8dd5a077df3503c527763145105b8f10f",
      "allowed_versions": ["1"],
      "version_card_refs": {
        "1": "aiproofing/benchmark/data/cards/synthetic_fixture_verifier_detector.md"
      }
    }
  ]
}
