{
  "schema_version": "2.0.0",
  "registry": "annotation_schemes",
  "registry_version": "2026-08-31.1",
  "snapshot_hash_scope": "SHA-256 of the registry entry's version label.",
  "entries": [
    {
      "id": "surface-lineage-v2",
      "owner": "Humanizer maintainers",
      "version": "2.0.0",
      "status": "active_contract",
      "source_reference": "aiproofing/benchmark/schemas/sample_revision.schema.json",
      "reviewed_at": "2026-08-31T00:00:00Z",
      "snapshot_hash": "262d6973cd766d32f2e4a1ccdef84d385b462fcbadbe1d6132bfaa2700aa1c02"
    }
  ]
}
